[
  {
    "id": "bld_0001",
    "customerId": "cus_0001",
    "roadAddress": "부산광역시 해운대구 연습로 60",
    "jibunAddress": "부산광역시 해운대구 가상동 50",
    "admCd": "2635010100",
    "registerKey": null,
    "adminCodeFallback": null,
    "name": "이음빌딩(가상)",
    "mainPurpose": "업무시설",
    "totalArea": 12803.25,
    "groundFloors": 17,
    "undergroundFloors": 5,
    "dongCount": 1,
    "approvalDate": "20150428",
    "source": "seed",
    "createdAt": "2026-02-06T01:00:00.000Z"
  },
  {
    "id": "bld_0002",
    "customerId": "cus_0001",
    "roadAddress": "서울특별시 마포구 테스트로 166",
    "jibunAddress": "서울특별시 마포구 모의동 379",
    "admCd": "1144013700",
    "registerKey": null,
    "adminCodeFallback": null,
    "name": "푸른프라자(가상)",
    "mainPurpose": "제2종근린생활시설",
    "totalArea": 2205.41,
    "groundFloors": 5,
    "undergroundFloors": 1,
    "dongCount": 1,
    "approvalDate": "20201010",
    "source": "seed",
    "createdAt": "2026-02-12T01:00:00.000Z"
  },
  {
    "id": "bld_0003",
    "customerId": "cus_0002",
    "roadAddress": "서울특별시 중구 연습로 131",
    "jibunAddress": "서울특별시 중구 모의동 194",
    "admCd": "1114018600",
    "registerKey": null,
    "adminCodeFallback": null,
    "name": "아라교육센터(가상)",
    "mainPurpose": "교육연구시설",
    "totalArea": 2842.91,
    "groundFloors": 7,
    "undergroundFloors": 0,
    "dongCount": 1,
    "approvalDate": "20050607",
    "source": "seed",
    "createdAt": "2026-02-10T01:00:00.000Z"
  },
  {
    "id": "bld_0004",
    "customerId": "cus_0002",
    "roadAddress": "서울특별시 중구 예시로 37",
    "jibunAddress": "서울특별시 중구 예시동 278",
    "admCd": "1114016400",
    "registerKey": null,
    "adminCodeFallback": null,
    "name": "한결타워(가상)",
    "mainPurpose": "업무시설",
    "totalArea": 16847.1,
    "groundFloors": 12,
    "undergroundFloors": 4,
    "dongCount": 1,
    "approvalDate": "20190804",
    "source": "seed",
    "createdAt": "2026-02-16T01:00:00.000Z"
  },
  {
    "id": "bld_0005",
    "customerId": "cus_0003",
    "roadAddress": "서울특별시 송파구 모의로 216",
    "jibunAddress": "서울특별시 송파구 견본동 211",
    "admCd": "1171017400",
    "registerKey": null,
    "adminCodeFallback": null,
    "name": "온새빌딩(가상)",
    "mainPurpose": "업무시설",
    "totalArea": 1994.64,
    "groundFloors": 13,
    "undergroundFloors": 1,
    "dongCount": 1,
    "approvalDate": "20150713",
    "source": "seed",
    "createdAt": "2026-02-13T01:00:00.000Z"
  },
  {
    "id": "bld_0006",
    "customerId": "cus_0003",
    "roadAddress": "대전광역시 유성구 예시로 163",
    "jibunAddress": "대전광역시 유성구 견본동 204",
    "admCd": "3020014200",
    "registerKey": null,
    "adminCodeFallback": null,
    "name": "마루타워(가상)",
    "mainPurpose": "업무시설",
    "totalArea": 3979.08,
    "groundFloors": 18,
    "undergroundFloors": 1,
    "dongCount": 1,
    "approvalDate": "19971226",
    "source": "seed",
    "createdAt": "2026-02-12T01:00:00.000Z"
  },
  {
    "id": "bld_0007",
    "customerId": "cus_0004",
    "roadAddress": "인천광역시 연수구 테스트로 98",
    "jibunAddress": "인천광역시 연수구 모의동 98",
    "admCd": "2818513900",
    "registerKey": null,
    "adminCodeFallback": null,
    "name": "라온빌리지(가상)",
    "mainPurpose": "공동주택",
    "totalArea": 36859,
    "groundFloors": 17,
    "undergroundFloors": 3,
    "dongCount": 1,
    "approvalDate": "20120813",
    "source": "seed",
    "createdAt": "2026-02-09T01:00:00.000Z"
  },
  {
    "id": "bld_0008",
    "customerId": "cus_0004",
    "roadAddress": "부산광역시 해운대구 모의로 38",
    "jibunAddress": "부산광역시 해운대구 모의동 568",
    "admCd": "2635011800",
    "registerKey": null,
    "adminCodeFallback": null,
    "name": "다솜타워(가상)",
    "mainPurpose": "업무시설",
    "totalArea": 17032.15,
    "groundFloors": 7,
    "undergroundFloors": 1,
    "dongCount": 1,
    "approvalDate": "20160818",
    "source": "seed",
    "createdAt": "2026-02-14T01:00:00.000Z"
  },
  {
    "id": "bld_0009",
    "customerId": "cus_0005",
    "roadAddress": "서울특별시 중구 견본로 227",
    "jibunAddress": "서울특별시 중구 가상동 180",
    "admCd": "1114017900",
    "registerKey": null,
    "adminCodeFallback": null,
    "name": "푸른파크(가상)",
    "mainPurpose": "공동주택",
    "totalArea": 16063.39,
    "groundFloors": 12,
    "undergroundFloors": 1,
    "dongCount": 1,
    "approvalDate": "20141005",
    "source": "seed",
    "createdAt": "2026-02-26T01:00:00.000Z"
  },
  {
    "id": "bld_0010",
    "customerId": "cus_0005",
    "roadAddress": "부산광역시 해운대구 샘플로 222",
    "jibunAddress": "부산광역시 해운대구 모의동 946",
    "admCd": "2635012000",
    "registerKey": null,
    "adminCodeFallback": null,
    "name": "미르정밀 제1공장(가상)",
    "mainPurpose": "공장",
    "totalArea": 2963.33,
    "groundFloors": 2,
    "undergroundFloors": 0,
    "dongCount": 1,
    "approvalDate": "19960904",
    "source": "seed",
    "createdAt": "2026-02-05T01:00:00.000Z"
  },
  {
    "id": "bld_0011",
    "customerId": "cus_0006",
    "roadAddress": "부산광역시 해운대구 시범길 208",
    "jibunAddress": "부산광역시 해운대구 예시동 247",
    "admCd": "2635011300",
    "registerKey": null,
    "adminCodeFallback": null,
    "name": "마루빌리지(가상)",
    "mainPurpose": "공동주택",
    "totalArea": 27083.07,
    "groundFloors": 20,
    "undergroundFloors": 1,
    "dongCount": 1,
    "approvalDate": "20040718",
    "source": "seed",
    "createdAt": "2026-02-12T01:00:00.000Z"
  },
  {
    "id": "bld_0012",
    "customerId": "cus_0006",
    "roadAddress": "서울특별시 중구 견본로 233",
    "jibunAddress": "서울특별시 중구 견본동 241",
    "admCd": "1114012400",
    "registerKey": null,
    "adminCodeFallback": null,
    "name": "새솔몰(가상)",
    "mainPurpose": "판매시설",
    "totalArea": 3109.93,
    "groundFloors": 4,
    "undergroundFloors": 2,
    "dongCount": 1,
    "approvalDate": "20170418",
    "source": "seed",
    "createdAt": "2026-02-25T01:00:00.000Z"
  },
  {
    "id": "bld_0013",
    "customerId": "cus_0007",
    "roadAddress": "경기도 수원시 영통구 시범길 90",
    "jibunAddress": "경기도 수원시 영통구 가상동 493",
    "admCd": "4111715200",
    "registerKey": null,
    "adminCodeFallback": null,
    "name": "새솔연구소(가상)",
    "mainPurpose": "교육연구시설",
    "totalArea": 10697.38,
    "groundFloors": 4,
    "undergroundFloors": 0,
    "dongCount": 1,
    "approvalDate": "20150515",
    "source": "seed",
    "createdAt": "2026-02-22T01:00:00.000Z"
  },
  {
    "id": "bld_0014",
    "customerId": "cus_0007",
    "roadAddress": "서울특별시 송파구 샘플로 122",
    "jibunAddress": "서울특별시 송파구 예시동 513",
    "admCd": "1171017800",
    "registerKey": null,
    "adminCodeFallback": null,
    "name": "가온정밀 제1공장(가상)",
    "mainPurpose": "공장",
    "totalArea": 6383.62,
    "groundFloors": 2,
    "undergroundFloors": 0,
    "dongCount": 1,
    "approvalDate": "20171223",
    "source": "seed",
    "createdAt": "2026-02-06T01:00:00.000Z"
  },
  {
    "id": "bld_0015",
    "customerId": "cus_0008",
    "roadAddress": "인천광역시 연수구 데모대로 30",
    "jibunAddress": "인천광역시 연수구 시범동 65",
    "admCd": "2818515500",
    "registerKey": null,
    "adminCodeFallback": null,
    "name": "마루프라자(가상)",
    "mainPurpose": "판매시설",
    "totalArea": 27517.21,
    "groundFloors": 10,
    "undergroundFloors": 3,
    "dongCount": 1,
    "approvalDate": "19970322",
    "source": "seed",
    "createdAt": "2026-02-14T01:00:00.000Z"
  },
  {
    "id": "bld_0016",
    "customerId": "cus_0008",
    "roadAddress": "경기도 성남시 분당구 본보기길 68",
    "jibunAddress": "경기도 성남시 분당구 예시동 955",
    "admCd": "4113516700",
    "registerKey": null,
    "adminCodeFallback": null,
    "name": "미르하이츠(가상)",
    "mainPurpose": "공동주택",
    "totalArea": 8677.23,
    "groundFloors": 16,
    "undergroundFloors": 2,
    "dongCount": 1,
    "approvalDate": "20220318",
    "source": "seed",
    "createdAt": "2026-02-20T01:00:00.000Z"
  },
  {
    "id": "bld_0017",
    "customerId": "cus_0009",
    "roadAddress": "서울특별시 송파구 가상길 130",
    "jibunAddress": "서울특별시 송파구 시범동 267",
    "admCd": "1171012600",
    "registerKey": null,
    "adminCodeFallback": null,
    "name": "라온타워(가상)",
    "mainPurpose": "업무시설",
    "totalArea": 20496.57,
    "groundFloors": 14,
    "undergroundFloors": 4,
    "dongCount": 1,
    "approvalDate": "20150413",
    "source": "seed",
    "createdAt": "2026-02-13T01:00:00.000Z"
  },
  {
    "id": "bld_0018",
    "customerId": "cus_0009",
    "roadAddress": "서울특별시 송파구 데모대로 239",
    "jibunAddress": "서울특별시 송파구 가상동 891",
    "admCd": "1171016500",
    "registerKey": null,
    "adminCodeFallback": null,
    "name": "다솜연구소(가상)",
    "mainPurpose": "교육연구시설",
    "totalArea": 10988.64,
    "groundFloors": 5,
    "undergroundFloors": 1,
    "dongCount": 1,
    "approvalDate": "19960321",
    "source": "seed",
    "createdAt": "2026-02-23T01:00:00.000Z"
  },
  {
    "id": "bld_0019",
    "customerId": "cus_0010",
    "roadAddress": "경기도 성남시 분당구 모의로 83",
    "jibunAddress": "경기도 성남시 분당구 모의동 72",
    "admCd": "4113517100",
    "registerKey": null,
    "adminCodeFallback": null,
    "name": "마루상가(가상)",
    "mainPurpose": "제2종근린생활시설",
    "totalArea": 1013.43,
    "groundFloors": 5,
    "undergroundFloors": 1,
    "dongCount": 1,
    "approvalDate": "19990808",
    "source": "seed",
    "createdAt": "2026-02-24T01:00:00.000Z"
  },
  {
    "id": "bld_0020",
    "customerId": "cus_0010",
    "roadAddress": "경기도 수원시 영통구 모의로 32",
    "jibunAddress": "경기도 수원시 영통구 예시동 300",
    "admCd": "4111714400",
    "registerKey": null,
    "adminCodeFallback": null,
    "name": "새솔프라자(가상)",
    "mainPurpose": "판매시설",
    "totalArea": 16701.31,
    "groundFloors": 8,
    "undergroundFloors": 5,
    "dongCount": 1,
    "approvalDate": "19960726",
    "source": "seed",
    "createdAt": "2026-02-04T01:00:00.000Z"
  },
  {
    "id": "bld_0021",
    "customerId": "cus_0011",
    "roadAddress": "서울특별시 송파구 가상길 221",
    "jibunAddress": "서울특별시 송파구 견본동 51",
    "admCd": "1171010200",
    "registerKey": null,
    "adminCodeFallback": null,
    "name": "별빛정밀 제1공장(가상)",
    "mainPurpose": "공장",
    "totalArea": 8589.96,
    "groundFloors": 3,
    "undergroundFloors": 0,
    "dongCount": 1,
    "approvalDate": "20060925",
    "source": "seed",
    "createdAt": "2026-02-15T01:00:00.000Z"
  },
  {
    "id": "bld_0022",